[
  {
    "id": "achievement:national-001",
    "type": "nationalInnovationProject",
    "title": {
      "zh": "智慧城市共享无人机"
    },
    "contributors": [
      {
        "displayName": "钟广祺",
        "role": "contributor",
        "order": 1,
        "externalUrl": null
      },
      {
        "displayName": "李权俊",
        "role": "contributor",
        "order": 2,
        "externalUrl": null
      }
    ],
    "evidenceRefs": [
      "evidence:achievements"
    ],
    "verifiedAt": "2026-09-01"
  },
  {
    "id": "achievement:national-002",
    "type": "nationalInnovationProject",
    "title": {
      "zh": "空巢老人居家养老志愿服务平台"
    },
    "contributors": [
      {
        "displayName": "吴梦淇",
        "role": "contributor",
        "order": 1,
        "externalUrl": null
      },
      {
        "displayName": "何昊锦",
        "role": "contributor",
        "order": 2,
        "externalUrl": null
      }
    ],
    "evidenceRefs": [
      "evidence:achievements"
    ],
    "verifiedAt": "2026-09-01"
  },
  {
    "id": "achievement:national-003",
    "type": "nationalInnovationProject",
    "title": {
      "zh": "CompathicalLM：基于多模态情感分析与RAG的心理危机干预系统"
    },
    "contributors": [
      {
        "displayName": "李嘉",
        "role": "contributor",
        "order": 1,
        "externalUrl": null
      }
    ],
    "evidenceRefs": [
      "evidence:achievements"
    ],
    "verifiedAt": "2026-09-01"
  },
  {
    "id": "achievement:national-004",
    "type": "nationalInnovationProject",
    "title": {
      "zh": "“智护云音”—基于物联网和边缘计算的智能护理机器人系统"
    },
    "contributors": [
      {
        "displayName": "储悦",
        "role": "contributor",
        "order": 1,
        "externalUrl": null
      }
    ],
    "evidenceRefs": [
      "evidence:achievements"
    ],
    "verifiedAt": "2026-09-01"
  },
  {
    "id": "achievement:national-005",
    "type": "nationalInnovationProject",
    "title": {
      "zh": "“髋影智诊”——基于深度神经网络的DDH影像辅助诊断模型系统"
    },
    "contributors": [
      {
        "displayName": "简灿",
        "role": "contributor",
        "order": 1,
        "externalUrl": null
      }
    ],
    "evidenceRefs": [
      "evidence:achievements"
    ],
    "verifiedAt": "2026-09-01"
  },
  {
    "id": "achievement:national-006",
    "type": "nationalInnovationProject",
    "title": {
      "zh": "果树智能检测系统的深度学习方法研究与应用"
    },
    "contributors": [
      {
        "displayName": "李嘉",
        "role": "contributor",
        "order": 1,
        "externalUrl": null
      }
    ],
    "evidenceRefs": [
      "evidence:achievements"
    ],
    "verifiedAt": "2026-09-01"
  },
  {
    "contributors": [
      {
        "displayName": "杨鹏",
        "externalUrl": null,
        "order": 1,
        "role": "contributor"
      }
    ],
    "evidenceRefs": [
      "evidence:achievements"
    ],
    "id": "achievement:national-007",
    "title": {
      "zh": "基于VIT与多模态表征融合的3DMRI医学图像分析"
    },
    "type": "nationalInnovationProject",
    "verifiedAt": "2026-09-17"
  },
  {
    "id": "achievement:provincial-001",
    "type": "provincialInnovationProject",
    "title": {
      "zh": "智能视障导航系统"
    },
    "contributors": [
      {
        "displayName": "钟淏舟",
        "role": "contributor",
        "order": 1,
        "externalUrl": null
      },
      {
        "displayName": "龙祖熹",
        "role": "contributor",
        "order": 2,
        "externalUrl": null
      }
    ],
    "evidenceRefs": [
      "evidence:achievements"
    ],
    "verifiedAt": "2026-09-01"
  },
  {
    "id": "achievement:provincial-002",
    "type": "provincialInnovationProject",
    "title": {
      "zh": "虹膜生物特征验证-医学图像保护联合系统"
    },
    "contributors": [
      {
        "displayName": "李权俊",
        "role": "contributor",
        "order": 1,
        "externalUrl": null
      }
    ],
    "evidenceRefs": [
      "evidence:achievements"
    ],
    "verifiedAt": "2026-09-01"
  },
  {
    "id": "achievement:provincial-003",
    "type": "provincialInnovationProject",
    "title": {
      "zh": "“电网智护”——基于边缘端与服务端协同工作的智能工人设备安全检查系统"
    },
    "contributors": [
      {
        "displayName": "夏涵",
        "role": "contributor",
        "order": 1,
        "externalUrl": null
      }
    ],
    "evidenceRefs": [
      "evidence:achievements"
    ],
    "verifiedAt": "2026-09-01"
  },
  {
    "id": "achievement:provincial-004",
    "type": "provincialInnovationProject",
    "title": {
      "zh": "“倾识”皇——多模态理解与生成的统一新范式"
    },
    "contributors": [
      {
        "displayName": "何昊锦",
        "role": "contributor",
        "order": 1,
        "externalUrl": null
      }
    ],
    "evidenceRefs": [
      "evidence:achievements"
    ],
    "verifiedAt": "2026-09-01"
  },
  {
    "id": "achievement:provincial-005",
    "type": "provincialInnovationProject",
    "title": {
      "zh": "慰晓心：基于事件感知与MLLM的心理危机预测干预系统"
    },
    "contributors": [
      {
        "displayName": "吴文涛",
        "role": "contributor",
        "order": 1,
        "externalUrl": null
      }
    ],
    "evidenceRefs": [
      "evidence:achievements"
    ],
    "verifiedAt": "2026-09-01"
  },
  {
    "id": "achievement:award-001",
    "type": "competition",
    "title": {
      "zh": "2022年全球华人大学生数据应用创新赛银奖"
    },
    "level": "第6",
    "contributors": [
      {
        "displayName": "黎韵童",
        "role": "recipient",
        "order": 1,
        "externalUrl": null
      }
    ],
    "evidenceRefs": [
      "evidence:achievements"
    ],
    "verifiedAt": "2026-09-01"
  },
  {
    "id": "achievement:award-002",
    "type": "competition",
    "title": {
      "zh": "第四届中国移动“梧桐杯”大数据创新大赛"
    },
    "level": "第8",
    "contributors": [
      {
        "displayName": "谷岩",
        "role": "recipient",
        "order": 1,
        "externalUrl": null
      },
      {
        "displayName": "黎韵童",
        "role": "recipient",
        "order": 2,
        "externalUrl": null
      }
    ],
    "evidenceRefs": [
      "evidence:achievements"
    ],
    "verifiedAt": "2026-09-01"
  },
  {
    "id": "achievement:award-003",
    "type": "competition",
    "title": {
      "zh": "2023年天池大赛全球智能汽车AI挑战赛"
    },
    "level": "第38",
    "contributors": [
      {
        "displayName": "徐烨灵",
        "role": "recipient",
        "order": 1,
        "externalUrl": null
      }
    ],
    "evidenceRefs": [
      "evidence:achievements"
    ],
    "verifiedAt": "2026-09-01"
  },
  {
    "contributors": [
      {
        "displayName": "吴奕均",
        "externalUrl": null,
        "order": 1,
        "role": "recipient"
      },
      {
        "displayName": "谢礼同",
        "externalUrl": null,
        "order": 2,
        "role": "recipient"
      }
    ],
    "evidenceRefs": [
      "evidence:achievements"
    ],
    "id": "achievement:award-078",
    "level": "银奖",
    "title": {
      "zh": "2026 AIY 黑客松"
    },
    "type": "competition",
    "verifiedAt": "2026-09-17"
  },
  {
    "id": "achievement:award-004",
    "type": "competition",
    "title": {
      "zh": "2024年世界人工智能大会第二届世界科学智能大赛"
    },
    "level": "第58",
    "contributors": [
      {
        "displayName": "徐烨灵",
        "role": "recipient",
        "order": 1,
        "externalUrl": null
      }
    ],
    "evidenceRefs": [
      "evidence:achievements"
    ],
    "verifiedAt": "2026-09-01"
  },
  {
    "id": "achievement:award-005",
    "type": "competition",
    "title": {
      "zh": "中国高校计算机大赛—基于5G和隐私保护的智能街景车"
    },
    "level": "国二",
    "contributors": [
      {
        "displayName": "乐祯",
        "role": "recipient",
        "order": 1,
        "externalUrl": null
      },
      {
        "displayName": "李权俊",
        "role": "recipient",
        "order": 2,
        "externalUrl": null
      }
    ],
    "evidenceRefs": [
      "evidence:achievements"
    ],
    "verifiedAt": "2026-09-01"
  },
  {
    "id": "achievement:award-006",
    "type": "competition",
    "title": {
      "zh": "中国高校计算机大赛—“云集干翼”-智慧城市共享无人机系统"
    },
    "level": "国二",
    "contributors": [
      {
        "displayName": "钟广祺",
        "role": "recipient",
        "order": 1,
        "externalUrl": null
      },
      {
        "displayName": "李权俊",
        "role": "recipient",
        "order": 2,
        "externalUrl": null
      }
    ],
    "evidenceRefs": [
      "evidence:achievements"
    ],
    "verifiedAt": "2026-09-01"
  },
  {
    "id": "achievement:award-007",
    "type": "competition",
    "title": {
      "zh": "中国高校计算机大赛—“智护云音”--基于物联网和边缘计算的智能护理机器人系统"
    },
    "level": "国二",
    "contributors": [
      {
        "displayName": "简灿",
        "role": "recipient",
        "order": 1,
        "externalUrl": null
      },
      {
        "displayName": "苏致弘",
        "role": "recipient",
        "order": 2,
        "externalUrl": null
      }
    ],
    "evidenceRefs": [
      "evidence:achievements"
    ],
    "verifiedAt": "2026-09-01"
  },
  {
    "id": "achievement:award-008",
    "type": "competition",
    "title": {
      "zh": "第二十六届CRAIC中国机器人及人工智能大赛"
    },
    "level": "国赛阶段",
    "contributors": [
      {
        "displayName": "何昊锦",
        "role": "recipient",
        "order": 1,
        "externalUrl": null
      }
    ],
    "evidenceRefs": [
      "evidence:achievements"
    ],
    "verifiedAt": "2026-09-01"
  },
  {
    "id": "achievement:award-009",
    "type": "competition",
    "title": {
      "zh": "第二十六届CRAIC中国机器人及人工智能大赛"
    },
    "level": "国赛阶段",
    "contributors": [
      {
        "displayName": "钟淏舟",
        "role": "recipient",
        "order": 1,
        "externalUrl": null
      }
    ],
    "evidenceRefs": [
      "evidence:achievements"
    ],
    "verifiedAt": "2026-09-01"
  },
  {
    "id": "achievement:award-010",
    "type": "competition",
    "title": {
      "zh": "第二十五届CRAIC中国机器人及人工智能大赛"
    },
    "level": "国三",
    "contributors": [
      {
        "displayName": "徐烨灵",
        "role": "recipient",
        "order": 1,
        "externalUrl": null
      }
    ],
    "evidenceRefs": [
      "evidence:achievements"
    ],